{
  "$schema": "https://json-schema.org/draft/2020-12/schema",
  "$id": "https://cmos.dev/schemas/registry/v1/eval-task.schema.json",
  "title": "Golden eval task",
  "description": "One golden eval task for a function-definition package. No prior format existed anywhere in the repo, so this schema is the canonical definition. A task states an input, an expectation (expected_output for generative functions, verdict for judgement functions), and a non-empty rubric of discrete, checkable pass/fail conditions.",
  "type": "object",
  "required": ["id", "description", "input", "rubric"],
  "additionalProperties": false,
  "anyOf": [
    {"required": ["expected_output"]},
    {"required": ["verdict"]}
  ],
  "properties": {
    "id": {
      "type": "string",
      "pattern": "^[a-z0-9]+(-[a-z0-9]+)*$",
      "minLength": 3,
      "maxLength": 80,
      "description": "Stable task id, unique within the package. Reported verbatim when a task fails."
    },
    "description": {
      "type": "string",
      "minLength": 10,
      "description": "What this task is holding the function to."
    },
    "input": {
      "type": "object",
      "description": "Input payload conforming to the package's own schema.json input shape.",
      "minProperties": 1
    },
    "expected_output": {
      "type": "object",
      "description": "Expected output shape for a generative function. Rubric entries, not deep equality, decide pass/fail.",
      "minProperties": 1
    },
    "verdict": {
      "type": "object",
      "description": "Expected judgement for a QA/gating function.",
      "required": ["pass"],
      "additionalProperties": false,
      "properties": {
        "pass": {
          "type": "boolean",
          "description": "Whether the function under test must judge the input as passing."
        },
        "violations": {
          "type": "array",
          "items": {"type": "string", "minLength": 3},
          "description": "Violation codes the function must emit, e.g. uncleared-client-reference."
        },
        "reason": {"type": "string", "minLength": 5}
      }
    },
    "rubric": {
      "type": "array",
      "minItems": 1,
      "description": "Non-empty list of discrete, checkable grading conditions. Every entry must be decidable identically by two independent graders (AC-18, enforced by lint_rubrics.py).",
      "items": {
        "type": "object",
        "required": ["criterion", "condition", "check_type"],
        "additionalProperties": false,
        "properties": {
          "criterion": {
            "type": "string",
            "minLength": 5,
            "description": "Short label for what is being graded."
          },
          "condition": {
            "type": "string",
            "minLength": 10,
            "description": "The discrete pass/fail test, stated so that two graders reach the same verdict. Unqualified subjective terms are rejected by lint_rubrics.py."
          },
          "check_type": {
            "enum": ["tool_check", "llm_judged"],
            "description": "tool_check: graded deterministically by the package's own tool_check.py. llm_judged: graded by a grading completion through the model gateway (mocked by default, never a real host)."
          },
          "check": {
            "type": "object",
            "description": "Machine-executable form of `condition`. Required so a mocked run is deterministic and a live run has an unambiguous ground truth.",
            "required": ["kind"],
            "properties": {
              "kind": {
                "type": "string",
                "minLength": 2,
                "description": "Check dispatch key. Generic kinds (contains_all, not_contains, regex, min_words, max_words, min_distinct) are implemented centrally; package-specific kinds are implemented by that package's tool_check.py."
              }
            }
          }
        }
      }
    },
    "notes": {
      "type": "string",
      "description": "Optional free-text provenance note (e.g. which positioning.md section this task is anchored to)."
    }
  }
}
